"field_name","type","units","allowed_values","description","required","notes"
"species","character","","P_alchata|P_orientalis","Species code","yes","If one file per species, species column can be omitted"
"site_id","character","","","Stable site identifier used across years","yes",""
"year","integer","year","","Year t","yes",""
"occupied","integer","","0|1","Occupancy state in year t (if stored directly)","conditional","If you store annual states, persistence/extinction can be derived in scripts"
"persistence","integer","","0|1","1 if occupied at t and t+1 (if used as response)","optional","Define the rule explicitly in scripts + README"
"extinction","integer","","0|1","1 if occupied at t and empty at t+1 (if used as response)","optional","Define the rule explicitly in scripts + README"
"n_visits","integer","visits",">=0","Number of visits/surveys (if available)","optional",""
"effort_km","numeric","km",">=0","Survey effort in km (if available)","optional",""
"region","character","","","Region/stratum (if used as random effect)","optional",""
